Agency Name,Type of service,Rating,Address,Contact details,Status,Website ,Reviews
Samarth Cabs,· Taxi service,4.8,near Surya Mandir,· 077738 95755,Open 24 hours,https://www.googleadservices.com/pagead/aclk?sa=L&ai=DChcSEwix9JfI4o2MAxV5pGYCHZJTKR0YABAIGgJzbQ&co=1&gclid=Cj0KCQjwytS-BhCKARIsAMGJyzqD22HPNp0wfZhSkZPJOkXKkGcRHozZTNDHpztGek-1-THi9eEWlKgaAkMlEALw_wcB&ohost=www.google.com&cid=CAESVeD2ZK3g8jMr7bBtVVw3CseyuH04tGQaRlHywwBCUqOjjj7sUDgfi42KAeZHxY4igQ7SVz6DwrjQ3uOxTNzM1OAS5XGBsPH3QgFj5-srT5waDRhDigA&sig=AOD64_1qsdIFfuC3pb_OR2PGCMdkOcs44g&q=&ctype=99&ved=2ahUKEwi0-pHI4o2MAxUuzDgGHS_VH3kQhKwBegQIIRAP&adurl=,
CAR ON CALL - Car rental with driver | Innova Crysta rental in indore | Tempo traveller on rent in Indore | Outstation taxi,· Car rental agency,4.7,"152, 1st floor, Mangal city, Mumbai - Agra National Highway, near Radisson blu hotel",· 099265 39973,Open 24 hours,http://www.instagram.com/caroncall,
Royal Car Rental Tour And Travels Indore Ujjain Omkareshwar | Bus Rental Indore | Urbania Rental Indore,· Car rental agency,5,"133/1, NEW-281/2, Bhagirathpura, Road, near Mamaji Dharmshala",· 095225 05152,Open,https://royalcarrental.in/,
Indore Self Driven car | hire taxi in indore | Innova Crysta rental in indore | cab in Indore | Outstation taxi,· Car rental agency,4.7,"102, VINAYAK APARTMENT, BENGALI SQUARE",· 062620 77787,Open 24 hours,https://indoreselfdrivencar.com/,
Car On Rent (Self Drive ) Best car rental in Indore,· Car leasing service,4.9,70,· 062661 62138,Open 24 hours,,
Indore Car Hire,· Car leasing service,5,"Office no.105, First Floor, Shagun Tower, AB Rd, above Apna Sweets",087707 62453,,https://indorecarhire.co.in/,"""Would definitely recommend for everyone who wants to move around Indore."""
SHYAM CAR RENTAL & TRAVELS - Car rental in indore with driver | Ertiga rent | Crysta rent | Dzire rent | Tempo traveller rent,· Car rental agency,4.8,"9/8, near Thakur the cafe",· 097559 55215,Open 24 hours,,"""I am happy with their rental service."""
Taxi 09 Self Drive Car Rental Indore,· Car rental agency,4.9,"Police Station, 1/6, G.sachchanand street, behind Vijay Nagar",· 097530 00064,Open 24 hours,https://taxi09.com/,
Red Self Drive Car | selfdrive car rental | Innova indore |care hire indore |crysta hire indore |outstation taxi,· Car rental agency,4.7,"74, behind guru kripa hotel",· 099930 90368,Open 24 hours,https://redselfdrivecar.com/,"""I found the car I rented to be in decent shape with clean interiors."""
SDC SELF DRIVEN /best car rental indore,· Car rental agency,4.9,"Dindayal upadhya parishad, behind chl hospital",· 072240 12354,Open 24 hours,,"""Extremely satisfied by the service and rent are pretty affordable."""
Arpit self drive cars |car hire with driver | Crysta hire in Indore | cab service in indore | Car rental with driver Taxi,· Car rental agency,4.8,"hanuman mandir Shradha, robot square 27, opp. chintaman",,Open 24 hours,,"""Cleaned, good conditioned, professional staff and fair charges."""
Indore car taxi,· Car rental agency,5,"Indore, Madhya Pradesh",095225 06070,,http://www.indorecartaxi.com/,"""The prices were decent and the services are great."""
GO WITH CAR | Self Drive Car Rental Service,· Car rental agency,4.7,"Square, Ring Rd, opposite Metro Wholesale",· 099262 22099,Open 24 hours,http://www.gowithcar.com/,
Xpress Car Rental Co. and Tempo Traveller in Indore/Ujjain/Omkareshwar,· Car rental agency,4.9,135,· 099777 77886,Open 24 hours,https://sites.google.com/view/xpresscarrental/home,
The Standard Journey (TSJ Cars Rental Services Private Limited),· Car rental agency,4.8,"Regency Arcade, 16 G, beside chartered bus",· 091091 23404,Open 24 hours,https://www.thestandardjourney.com/,
Q Rental Car Indore,· Car leasing service,4.9,"Plot numbers 43, LIG Link Rd",· 090098 49159,Open 24 hours,https://www.qrentalcar.com/,"""Nice rental experience."""
Pan India Car Rental Indore - Bus Rental Indore l Tempo Traveller On Rent In Indore l Tour And Travels Outstation taxi,· Car rental agency,5,55 B,· 092012 77035,Open 24 hours,http://www.panindiacarrental.com/,
AoneCarz Self Drive Cars in Jaipur,· Car rental agency,5,"204/A, beside Rajgarh Kothi",,Open 24 hours,https://www.facebook.com/profile.php?id=61558487947168&mibextid=ZbWKwL,"""Highly recommended to others"""
Self Drive Car Rental Indore,· Car rental agency,5,"A, 11, Bapat Square, near murliwala sweet",,,,"""Best service the car rental self driving"""
Ahilya Car Rental Indore Ujjain Omkareshwar | Innova Crysta Rental | Ertiga Rental | Traveller Rental Indore,· Car rental agency,4.8,"Plot No.141/217 Suyash Vihar, behind Hotel J W Marriott",· 097709 00876,Open,http://ahilyacarrental.com/,
Choice Car Rental - Self Drive Car Rental Indore,· Car rental agency,4.9,"287-A, near Mahalaxmi Mandir",· 079879 77630,Open 24 hours,https://www.instagram.com/choice_car_rental_,"""Best car car rental service I had ever experienced"""
